place_id,name,description,is_spending_on_ads,reviews,competitors,website,owner_name,owner_profile_link,featured_image,main_category,categories,rating,workday_timing,closed_on,phone,address,review_keywords,link
ChIJ7Vz9a9yVuEwRjUKqbbOLHw4,Fairmont Le Chateau Frontenac,"Historic, high-end hotel offering plush quarters, plus fine dining, a spa, a wine bar & river views.",False,20935,,https://www.fairmont.com/frontenac-quebec/%3Fgoto%3Dfiche_hotel%26code_hotel%3DA572%26merchantid%3Dseo-maps-FR-A572%26sourceid%3Daw-cen%26utm_medium%3Dseo%2Bmaps%26utm_source%3Dgoogle%2BMaps%26utm_campaign%3Dseo%2Bmaps%3Fgoto%3Dfiche_hotel%26code_hotel%3DA572%26merchantid%3Dseo-maps-CA-A572%26sourceid%3Daw-cen%26utm_medium%3Dseo%2Bmaps%26utm_source%3Dgoogle%2BMaps%26utm_campaign%3Dseo%2Bmaps%26y_source%3D1_MTIzNjE0MDAtNzE1LWxvY2F0aW9uLndlYnNpdGU%3D,Fairmont Le Chateau Frontenac (Owner),https://www.google.com/maps/contrib/100557740916750737992,https://lh3.googleusercontent.com/gps-proxy/AMy85WIwoz9lDBKC4prtDsA4ruKmmgSW0rf_doIO1kUBJPlVbqdQQiSY8u7gSb_qS4abSyLlppC2ggPqgIbX87ZptPaEmf4W51tJm-AB5V9bZ48SIgeUKSATuiMhoYwlrevSy3wkZd_-gjztLM2UvXUnzAji4arPdhjVEiEGRhnfn493Aua2kwAVzNjZ=w408-h272-k-no,Hotel,"Hotel, Tourist attraction, Wedding venue",4.7,,Open All Days,+1 418-692-3861,"Fairmont Le Chateau Frontenac, 1 Rue des Carrieres, Quebec City, Quebec G1R 4P5, Canada","main stem, emblem, guardian: the lonely and great god, korean drama, christmas trees, 1608, icon, quartier petit champlain, sam",https://www.google.com/maps/place/Fairmont+Le+Ch%C3%A2teau+Frontenac/data=!4m10!3m9!1s0x4cb895dc6bfd5ced:0xe1f8bb36daa428d!5m2!4m1!1i2!8m2!3d46.8120085!4d-71.2052184!16zL20vMDI3ZGxy!19sChIJ7Vz9a9yVuEwRjUKqbbOLHw4?authuser=0&hl=en&rclk=1
ChIJGTOa4r6CToYRcxo6BG7dDr4,Omni Las Colinas Hotel,"Upscale lodging with a refined restaurant, an outdoor pool & a spa, plus meeting space & bars.",False,3392,,https://www.omnihotels.com/hotels/dallas-las-colinas%3Futm_source%3Dgmblisting%26utm_medium%3Dorganic,Omni Las Colinas Hotel (Owner),https://www.google.com/maps/contrib/116632673859192298094,https://lh5.googleusercontent.com/p/AF1QipOEzUiw1VPjRn5fEW7tIoJyGfMWFU-p8LKwXkOy=w408-h290-k-no,Hotel,Hotel,4.4,,Open All Days,(972) 556-0800,"Omni Las Colinas Hotel, 221 Las Colinas Blvd E, Irving, TX 75039","lake, canal, valet, anniversary, staycation, parking garage, ballroom, rewards program, DFW, toyota music factory",https://www.google.com/maps/place/Omni+Las+Colinas+Hotel/data=!4m10!3m9!1s0x864e82bee29a3319:0xbe0edd6e043a1a73!5m2!4m1!1i2!8m2!3d32.8676779!4d-96.9378491!16s%2Fm%2F0wfhmq_!19sChIJGTOa4r6CToYRcxo6BG7dDr4?authuser=0&hl=en&rclk=1
ChIJeVu6NvJsK4cRFeSkmW5mfgE,Super 8 by Wyndham Phoenix Metro North,Straightforward budget hotel offering en suite bathrooms plus an outdoor pool & free parking.,False,1784,,https://www.wyndhamhotels.com/super-8/phoenix-arizona/super-8-phoenix-metro-north/overview%3FCID%3DLC:SE::GGL:RIO:National:10753%26iata%3D00093796,Super 8 by Wyndham Phoenix Metro North (Owner),https://www.google.com/maps/contrib/106793877406289021441,https://lh5.googleusercontent.com/p/AF1QipOdTOosxLy5UyIWRtsvy8Vlo9lBL5U9ZaXduGwC=w408-h272-k-no,Hotel,"Hotel, Inn, Motel",2.3,,Open All Days,(602) 995-8451,"Super 8 by Wyndham Phoenix Metro North, 8130 N Black Cyn Hwy, Phoenix, AZ 85051","roaches, homeless, bed bugs, graffiti, smoking room, security guard, cops, burn, drug use, loitering",https://www.google.com/maps/place/Super+8+by+Wyndham+Phoenix+Metro+North/data=!4m10!3m9!1s0x872b6cf236ba5b79:0x17e666e99a4e415!5m2!4m1!1i2!8m2!3d33.5560335!4d-112.1136334!16s%2Fg%2F1v62j3j3!19sChIJeVu6NvJsK4cRFeSkmW5mfgE?authuser=0&hl=en&rclk=1
ChIJFQk9psBibIcRJvIDxSv9npc,La Quinta Inn & Suites by Wyndham Denver Aurora Medical,"Casual property with an outdoor pool, plus free continental breakfast, WiFi & parking.",False,1342,,https://www.wyndhamhotels.com/laquinta/aurora-colorado/la-quinta-inn-and-suites-denver-aurora-medical-ctr/overview%3FCID%3DLC:6ysy27krtpcrqev:53732,La Quinta Inn & Suites by Wyndham Denver Aurora Medical (Owner),https://www.google.com/maps/contrib/110988153226442424902,https://lh5.googleusercontent.com/p/AF1QipMhVxH2JMls2nEjJ-pBArrh7E1AJ4dz-CoFjMXg=w426-h240-k-no,Hotel,"Hotel, Inn, Motel",3.3,,Open All Days,(303) 369-8400,"La Quinta Inn & Suites by Wyndham Denver Aurora Medical, 1500 S Abilene St, Aurora, CO 80012","front desk, carpet, microwave, stains, waffles, clerk, cigarette, employee, barking, urine",https://www.google.com/maps/place/La+Quinta+Inn+%26+Suites+by+Wyndham+Denver+Aurora+Medical/data=!4m10!3m9!1s0x876c62c0a63d0915:0x979efd2bc503f226!5m2!4m1!1i2!8m2!3d39.6889125!4d-104.8273584!16s%2Fg%2F1w04klmp!19sChIJFQk9psBibIcRJvIDxSv9npc?authuser=0&hl=en&rclk=1
ChIJnSpf2Rry2YkR24A4ZB0V6vE,Holiday Inn & Suites Syracuse Airport,"Modern hotel offering homey rooms & suites, plus a pool, a restaurant & free breakfast.",False,1329,,https://www.ihg.com/holidayinn/hotels/us/en/liverpool/syrlv/hoteldetail,Holiday Inn & Suites Syracuse Airport (Owner),https://www.google.com/maps/contrib/105040018853417769081,https://lh5.googleusercontent.com/p/AF1QipO2R4lO7SCKKtCuLhl9Rnes4FpHFGfT7e_biOeq=w408-h271-k-no,Hotel,"Hotel, Bar, Extended stay hotel, Lounge, Restaurant",4.3,,Open All Days,(315) 451-1511,"Holiday Inn & Suites Syracuse Airport, 400 7th N St, Liverpool, NY 13088","hot tub, front desk, gym, kitchenette, snacks, flight, continental breakfast, destiny usa, fertility, drivers",https://www.google.com/maps/place/Holiday+Inn+%26+Suites+Syracuse+Airport/data=!4m10!3m9!1s0x89d9f21ad95f2a9d:0xf1ea151d643880db!5m2!4m1!1i2!8m2!3d43.092028!4d-76.169328!16s%2Fg%2F1ptxhbvqm!19sChIJnSpf2Rry2YkR24A4ZB0V6vE?authuser=0&hl=en&rclk=1
ChIJbzYFRyWZVogRMaXSYBaC_6c,Hilton Charlotte Airport,"Laid-back hotel offering a free airport shuttle, plus a restaurant, a bar & an indoor pool.",False,1087,,https://www.hilton.com/en/hotels/cltachh-hilton-charlotte-airport/%3FSEO_id%3DGMB-AMER-HH-CLTACHH%26y_source%3D1_MTUwNjEwNDQtNzE1LWxvY2F0aW9uLndlYnNpdGU%253D,Hilton Charlotte Airport (Owner),https://www.google.com/maps/contrib/102377461774357732935,https://lh5.googleusercontent.com/p/AF1QipPnpe337jc9eBrBn_uXCrW6dQ0oNtHLFgoKVd8X=w408-h272-k-no,Hotel,Hotel,4.3,,Open All Days,(704) 357-1414,"Hilton Charlotte Airport, 2800 Coliseum Centre Dr, Charlotte, NC 28217","front desk, flight, conference, bartender, diamond, shuttle, lounge, driver, van, CLT",https://www.google.com/maps/place/Hilton+Charlotte+Airport/data=!4m10!3m9!1s0x885699254705366f:0xa7ff821660d2a531!5m2!4m1!1i2!8m2!3d35.1885478!4d-80.9153268!16s%2Fg%2F11j4pk6ddz!19sChIJbzYFRyWZVogRMaXSYBaC_6c?authuser=0&hl=en&rclk=1
ChIJ1dAYSn_JxokRCXHifxz9jXg,Hilton Garden Inn Camden Waterfront Philadelphia,"Unfussy rooms & suites, some featuring river views, in a polished hotel offering a restaurant/bar.",False,719,,https://www.hilton.com/en/hotels/ttncagi-hilton-garden-inn-camden-waterfront-philadelphia/%3FSEO_id%3DGMB-AMER-GI-TTNCAGI%26y_source%3D1_MTg4NDA3MTctNzE1LWxvY2F0aW9uLndlYnNpdGU%253D,Hilton Garden Inn Camden Waterfront Philadelphia (Owner),https://www.google.com/maps/contrib/105228138393383153162,https://lh5.googleusercontent.com/p/AF1QipMtxrOzQxmlsW7Ffq-_Tkoj2DTTEld2PvBmdyF4=w408-h272-k-no,Hotel,Hotel,4.3,,Open All Days,(856) 756-0070,"Hilton Garden Inn Camden Waterfront Philadelphia, 1 Penn St, Camden, NJ 08102","river, desk, concert, property, diamond, check, sandwich, gym, app, fee",https://www.google.com/maps/place/Hilton+Garden+Inn+Camden+Waterfront+Philadelphia/data=!4m10!3m9!1s0x89c6c97f4a18d0d5:0x788dfd1c7fe27109!5m2!4m1!1i2!8m2!3d39.949914!4d-75.1302874!16s%2Fg%2F11jp5btwnf!19sChIJ1dAYSn_JxokRCXHifxz9jXg?authuser=0&hl=en&rclk=1
ChIJJUNIwapx1oYR3bBNQFmOr14,DoubleTree by Hilton Tucson Downtown Convention Center,"Upmarket hotel next to Tucson Convention Center offering a restaurant, a chic bar & an outdoor pool.",False,580,,https://www.hilton.com/en/hotels/tusaudt-doubletree-tucson-downtown-at-the-convention-center/%3FSEO_id%3DGMB-AMER-DT-TUSAUDT%26y_source%3D1_MTk2OTEyOTUtNzE1LWxvY2F0aW9uLndlYnNpdGU%253D,DoubleTree by Hilton Tucson Downtown Convention Center (Owner),https://www.google.com/maps/contrib/111396214178312619247,https://lh5.googleusercontent.com/p/AF1QipNWSzIJw3cB42WLVc2SC8MT0WytTI6iPtSzin2a=w408-h272-k-no,Hotel,Hotel,4.5,,Open All Days,(520) 372-7100,"DoubleTree by Hilton Tucson Downtown Convention Center, 280 S Church Ave, Tucson, AZ 85701","parking, front desk, check in, bartender, property, valet, barista, cookies, here again, happy hour",https://www.google.com/maps/place/DoubleTree+by+Hilton+Tucson+Downtown+Convention+Center/data=!4m10!3m9!1s0x86d671aac1484325:0x5eaf8e59404db0dd!5m2!4m1!1i2!8m2!3d32.2173181!4d-110.9732059!16s%2Fg%2F11lfbjwff6!19sChIJJUNIwapx1oYR3bBNQFmOr14?authuser=0&hl=en&rclk=1
ChIJ9Y4p9USWtywRD-K0d7v2E_E,Aurora Kakadu Lodge & Caravan Park,"Low-key cabins, some with kitchenettes & patios, in a casual hotel offering a bistro & a pool.",False,565,,https://aurorakakadulodge.com.au/,Aurora Kakadu Lodge & Caravan Park (Owner),https://www.google.com/maps/contrib/110472514591830484420,https://lh3.googleusercontent.com/gps-proxy/AMy85WLatJtwoCGb4WhXQx8-A_-tvwAzp3z7vgXdZp1PctAKQl8EnB02nOwOCVmEfvJvfjJTZCM389ipJKRNH86OSTziHf_UxVcD5IdgQVQ82CGORjmUY4xyok6rWyO9ucG50jPZBtCyTMHa9WJiuXDcExVsKLZkm9gvDrxoSdhKOV17r9zMG_47a4u9=w408-h273-k-no,Holiday park,"Holiday park, Campground, Motel, RV park",4,,Open All Days,+61 8 8979 2422,"Aurora Kakadu Lodge & Caravan Park, Jabiru Drive, Kakadu NT 0886, Australia","pool, bar, area, bistro, amenities, cabins, air conditioning, camp kitchen, relaxing, shade",https://www.google.com/maps/place/Aurora+Kakadu+Lodge+%26+Caravan+Park/data=!4m10!3m9!1s0x2cb796431582388b:0xf113f6bb77b4e20f!5m2!4m1!1i2!8m2!3d-12.662805!4d132.835783!16s%2Fg%2F11cmst775f!19sChIJiziCFUOWtywRD-K0d7v2E_E?authuser=0&hl=en&rclk=1
ChIJVe_keAORwCwRX-quSW_rkoQ,Vibe Hotel Darwin Waterfront,"Streamlined rooms, some with sea views, in a laid-back property offering a modern cafe/bar.",False,498,,https://vibehotels.com/book-accommodation/darwin/hotel-darwin-waterfront/%3Fpromo_code%3DBOOKDIRECT%26utm_source%3Dgoogleplaces%26utm_medium%3Dorganic%26utm_campaign%3Dgoogleplaces%26utm_content%3Dvibe-darwin-waterfront%26utm_term%3Dplcid_14878817266618143585,Vibe Hotel Darwin Waterfront (Owner),https://www.google.com/maps/contrib/117876307533120702061,https://lh5.googleusercontent.com/p/AF1QipNSyWUymN8bLehS9J-x0UXd6TS1X1BJcoj1S-Oc=w408-h272-k-no,Hotel,"Hotel, Event venue, Restaurant, Wedding venue",4.2,,Open All Days,+61 8 8982 9999,"Vibe Hotel Darwin Waterfront, 7 Kitchener Dr, Darwin City NT 0800, Australia","clean, walk, wave pool, carpark, lift, town, money, atmosphere, bridge, distance",https://www.google.com/maps/place/Vibe+Hotel+Darwin+Waterfront/data=!4m10!3m9!1s0x2cc09104c3cd24eb:0x8492eb6f49aeea5f!5m2!4m1!1i2!8m2!3d-12.466665!4d130.846415!16s%2Fg%2F1hhn936lz!19sChIJ6yTNwwSRwCwRX-quSW_rkoQ?authuser=0&hl=en&rclk=1
ChIJnaznC-nwBFMRbMoSc_q3bos,Sandman Signature Saskatoon South Hotel,"Casual rooms & suites in an unpretentious hotel offering an indoor pool & a gym, plus 2 restaurants.",False,424,,https://www.sandmanhotels.com/signature-saskatoon-south%3Futm_source%3Dgoogle%26utm_medium%3Dmaps%26utm_campaign%3Dsignature_saskatoon_south,Sandman Signature Saskatoon South Hotel (Owner),https://www.google.com/maps/contrib/106036763858017681115,https://lh5.googleusercontent.com/p/AF1QipOY5A7aWF1R-U2D2SodEEgC0Jzaw7U-uFY0CJAT=w426-h240-k-no,Hotel,Hotel,4.4,,Open All Days,+1 306-518-7263,"Sandman Signature Saskatoon South Hotel, 2815 Lorne Ave, Saskatoon, SK S7J 0S5, Canada","front desk, suite, check in, hot tub, steakhouse, amenities, kitchenette, wedding, chop, truck",https://www.google.com/maps/place/Sandman+Signature+Saskatoon+South+Hotel/data=!4m10!3m9!1s0x5304f0e90be7ac9d:0x8b6eb7fa7312ca6c!5m2!4m1!1i2!8m2!3d52.0945172!4d-106.6691875!16s%2Fg%2F11g9vlmkcb!19sChIJnaznC-nwBFMRbMoSc_q3bos?authuser=0&hl=en&rclk=1
ChIJeSjBn42hwokRfNxDLhzSaI8,"Holiday Inn Express & Suites Stamford, an IHG Hotel","Contemporary lodging with a business center, plus free hot breakfast & WiFi.",False,419,,https://www.ihg.com/holidayinnexpress/hotels/us/en/stamford/stmex/hoteldetail%3Fcm_mmc%3DGoogleMaps-_-EX-_-US-_-STMEX,"Holiday Inn Express & Suites Stamford, an IHG Hotel (Owner)",https://www.google.com/maps/contrib/102592035790072628550,https://lh5.googleusercontent.com/p/AF1QipOeJyEXUaxI-q0iAPUsg_4n2jZDnR9swoA84XUC=w408-h271-k-no,Hotel,"Hotel, Conference center, Wedding venue",3.9,,Open All Days,(203) 978-5600,"Holiday Inn Express & Suites Stamford, an IHG Hotel, 2703 Summer St, Stamford, CT 06905","parking, clean rooms, desk, lobby, garage, tub, renovations, bar, convention, check","https://www.google.com/maps/place/Holiday+Inn+Express+%26+Suites+Stamford,+an+IHG+Hotel/data=!4m10!3m9!1s0x89c2a18d9fc12879:0x8f68d21c2e43dc7c!5m2!4m1!1i2!8m2!3d41.0694656!4d-73.5486526!16s%2Fg%2F1vy7hhr6!19sChIJeSjBn42hwokRfNxDLhzSaI8?authuser=0&hl=en&rclk=1"
ChIJ25JnJOkIK4cRE8Ew7iYhFvM,Super 8 by Wyndham Tempe/ASU/Airport,Straightforward budget hotel with an outdoor pool plus a hot tub as well as free parking & WiFi.,False,377,,https://www.wyndhamhotels.com/super-8/tempe-arizona/super-8-tempe-asu-airport/overview%3FCID%3DLC:SE::GGL:RIO:National:03070%26iata%3D00093796,Super 8 by Wyndham Tempe/ASU/Airport (Owner),https://www.google.com/maps/contrib/105603227733629979941,https://lh5.googleusercontent.com/p/AF1QipP0l_1rNgcgdAe-GBKXE_YElgedvYc56wVc5N32=w408-h272-k-no,Hotel,"Hotel, Lodge",3.7,,Open All Days,(480) 967-8891,"Super 8 by Wyndham Tempe/ASU/Airport, 1020 E Apache Blvd, Tempe, AZ 85281","carpet, desk, walking, hot tub, microwave, distance, construction, stains, cigarettes, roaches",https://www.google.com/maps/place/Super+8+by+Wyndham+Tempe%2FASU%2FAirport/data=!4m10!3m9!1s0x872b08e9246792db:0xf3162126ee30c113!5m2!4m1!1i2!8m2!3d33.4149872!4d-111.9236611!16s%2Fg%2F1tc_llzp!19sChIJ25JnJOkIK4cRE8Ew7iYhFvM?authuser=0&hl=en&rclk=1
ChIJ_6YWnLJ5bIcRdx9VJGF_eGs,Hyatt Centric Downtown Denver,"Sleek hotel offering a lobby bar, an exercise room & a restaurant, plus a rooftop terrace.",False,241,,https://www.hyatt.com/hyatt-centric/denct-hyatt-centric-downtown-denver/%3Fsrc%3Dcorp_lclb_gmb_seo_denct,Hyatt Centric Downtown Denver (Owner),https://www.google.com/maps/contrib/115511574244812034501,https://lh5.googleusercontent.com/p/AF1QipNYXYChZGXLMwfkrjD2x_MDUHrVJAzwZqzefpUj=w408-h611-k-no,Hotel,Hotel,4,,Open All Days,(303) 529-2340,"Hyatt Centric Downtown Denver, 1776 Champa St, Denver, CO 80202","bar, valet parking, front desk, housekeeping, property, fee, credit card, homeless, parking garage, meeting",https://www.google.com/maps/place/Hyatt+Centric+Downtown+Denver/data=!4m10!3m9!1s0x876c79b29c16a6ff:0x6b787f6124551f77!5m2!4m1!1i2!8m2!3d39.7481721!4d-104.9916796!16s%2Fg%2F11pqbr4yc7!19sChIJ_6YWnLJ5bIcRdx9VJGF_eGs?authuser=0&hl=en&rclk=1
ChIJ95Z9oGz17IgRXdfLr0yZdkk,Hyatt House Tallahassee Capitol - University,"Sleek quarters, some with kitchenettes, in an informal hotel offering a cafe/bar & an outdoor pool.",False,234,,https://www.hyatt.com/en-US/hotel/florida/hyatt-house-tallahassee-capitol-university/tlhxt/%3Fsrc%3Dcorp_lclb_gmb_seo_tlhxt,Hyatt House Tallahassee Capitol - University (Owner),https://www.google.com/maps/contrib/107569130535790966791,https://lh5.googleusercontent.com/p/AF1QipMnJNhNG_GlL8qEasINljcKmr5Vd33zcCu9Z-Ep=w408-h272-k-no,Hotel,Hotel,4.3,,Open All Days,(850) 222-0039,"Hyatt House Tallahassee Capitol - University, 1100 Railroad Ave, Tallahassee, FL 32310","parking, desk, walking, music, campus, housekeeping, gym, here again, college, suite",https://www.google.com/maps/place/Hyatt+House+Tallahassee+Capitol+-+University/data=!4m10!3m9!1s0x88ecf56ca07d96f7:0x4976994cafcbd75d!5m2!4m1!1i2!8m2!3d30.4326399!4d-84.2899453!16s%2Fg%2F11l0mk9917!19sChIJ95Z9oGz17IgRXdfLr0yZdkk?authuser=0&hl=en&rclk=1
ChIJrQzPLCeQsFIRuVkepKEegdk,Super 8 by Wyndham Grand Rapids,"Standard budget lodging with a gym & meeting rooms, plus free continental breakfast & WiFi.",False,230,,https://www.wyndhamhotels.com/super-8/grand-rapids-minnesota/super-8-grand-rapids/overview%3FCID%3DLC:SE::GGL:RIO:National:03647%26iata%3D00093796,Super 8 by Wyndham Grand Rapids (Owner),https://www.google.com/maps/contrib/105304137917450385248,https://lh5.googleusercontent.com/p/AF1QipMUCpRsuayGkAGhDGCRjqimtn-nfsrB6-jZFnbg=w426-h240-k-no,Hotel,"Hotel, Lodge",4.1,,Open All Days,(218) 327-1108,"Super 8 by Wyndham Grand Rapids, 1702 S Pokegama Ave, Grand Rapids, MN 55744","clean rooms, comfortable, desk, morning, coffee, shower, floor, parking, biscuits and gravy, check in",https://www.google.com/maps/place/Super+8+by+Wyndham+Grand+Rapids/data=!4m10!3m9!1s0x52b090272ccf0cad:0xd9811ea1a41e59b9!5m2!4m1!1i2!8m2!3d47.213417!4d-93.5277557!16s%2Fg%2F1tftwlvz!19sChIJrQzPLCeQsFIRuVkepKEegdk?authuser=0&hl=en&rclk=1
ChIJfyn8wG9D24gR9rerAJLPYE0,Fairfield Inn & Suites by Marriott Cape Coral/North Fort Myers,"Understated rooms & suites in a casual hotel with an outdoor pool, a gym & breakfast.",False,224,,https://www.marriott.com/en-us/hotels/rswfm-fairfield-inn-and-suites-cape-coral-north-fort-myers/overview/%3Fscid%3Df2ae0541-1279-4f24-b197-a979c79310b0,Fairfield Inn & Suites by Marriott Cape Coral/North Fort Myers (Owner),https://www.google.com/maps/contrib/107102881715913611101,https://lh5.googleusercontent.com/p/AF1QipN2XVq4Uu6Iui0UjpuI-hqFshJytkdmRNmDuTU=w426-h240-k-no,Hotel,"Hotel, Meeting planning service",4.6,,Open All Days,(239) 652-0269,"Fairfield Inn & Suites by Marriott Cape Coral/North Fort Myers, 1701 Old Pondella Rd, Cape Coral, FL 33909","clean, desk, shower, trip, property, area, pool, check in, amenities, star",https://www.google.com/maps/place/Fairfield+Inn+%26+Suites+by+Marriott+Cape+Coral%2FNorth+Fort+Myers/data=!4m10!3m9!1s0x88db436fc0fc297f:0x4d60cf9200abb7f6!5m2!4m1!1i2!8m2!3d26.6668071!4d-81.9384841!16s%2Fg%2F11lfh5r315!19sChIJfyn8wG9D24gR9rerAJLPYE0?authuser=0&hl=en&rclk=1
ChIJtWIN75KnMlMR9UppNVVAXv8,Four Points by Sheraton Deadwood,"Understated rooms in a laid-back hotel featuring a lobby bar, a fitness center & dining.",False,198,,https://www.marriott.com/en-us/hotels/rapfp-four-points-by-sheraton-deadwood/overview/?scid=f2ae0541-1279-4f24-b197-a979c79310b0,Four Points by Sheraton Deadwood (Owner),https://www.google.com/maps/contrib/116710377926079340763,https://lh5.googleusercontent.com/p/AF1QipPDu7CIholiK7O74Qolbc6uHVvCYBLHTFWJCBOo=w408-h272-k-no,Hotel,"Hotel, Meeting planning service",4.2,,Open All Days,(605) 791-5020,"Four Points by Sheraton Deadwood, 575 Main St, Deadwood, SD 57732","parking, shower, walk, casino, bar, desk, fees, check in, lobby, amenities",https://www.google.com/maps/place/Four+Points+by+Sheraton+Deadwood/data=!4m10!3m9!1s0x5332a792ef0d62b5:0xff5e405535694af5!5m2!4m1!1i2!8m2!3d44.3791414!4d-103.7271174!16s%2Fg%2F11qy7y9k4h!19sChIJtWIN75KnMlMR9UppNVVAXv8?authuser=0&hl=en&rclk=1
ChIJl_Hg2-ndN1MR4PRPy4luTyM,Super 8 by Wyndham Hardin,"Straightforward budget hotel with fitness & business centers, plus free breakfast & WiFi.",False,175,,https://www.wyndhamhotels.com/super-8/hardin-montana/super-8-hardin/overview%3FCID%3DLC:SE::GGL:RIO:National:03742%26iata%3D00065402,Super 8 by Wyndham Hardin (Owner),https://www.google.com/maps/contrib/103720086531205394523,https://lh5.googleusercontent.com/p/AF1QipP-x8lKml60-oYWOe8dFichpSn0acO8fyWGEARS=w408-h272-k-no,Hotel,"Hotel, Inn, Lodge",3.9,,Open All Days,(406) 665-1870,"Super 8 by Wyndham Hardin, 201 14th St W, Hardin, MT 59034","clean, desk, price, slept, cereal, comfortable, TV, wifi, fast food, continental breakfast",https://www.google.com/maps/place/Super+8+by+Wyndham+Hardin/data=!4m10!3m9!1s0x5337dde9dbe0f197:0x234f6e89cb4ff4e0!5m2!4m1!1i2!8m2!3d45.7440226!4d-107.6099708!16s%2Fg%2F1vl5gfkk!19sChIJl_Hg2-ndN1MR4PRPy4luTyM?authuser=0&hl=en&rclk=1
ChIJdR088ihXSjERZRhcSTSRFG0,CAM cafe,,False,96,"Name: Cong Ca Phe
link: https://www.google.com/maps/search/C%E1%BB%99ng+C%C3%A0+Ph%C3%AA/@20.95337,107.0458915?authuser=0&hl=en&entry=ttu
Reviews: 825 reviews

Name: Kafa Bai Chay
link: https://www.google.com/maps/search/Kafa+B%C3%A3i+Ch%C3%A1y/@20.947979,107.0264254?authuser=0&hl=en&entry=ttu
Reviews: 181 reviews

Name: Museum Cafe
link: https://www.google.com/maps/search/Museum+Cafe/@20.9481717,107.0977168?authuser=0&hl=en&entry=ttu
Reviews: 149 reviews

Name: Cafe Cam Xuc
link: https://www.google.com/maps/search/Cafe+C%E1%BA%A3m+X%C3%BAc/@20.9527283,107.1021226?authuser=0&hl=en&entry=ttu
Reviews: 11 reviews",https://instagram.com/tiemcamcafe%3Figshid%3D1fzcbe14y5kbt,CAM cafe (Owner),https://www.google.com/maps/contrib/103426522629248071344,https://lh5.googleusercontent.com/p/AF1QipN-Tt2v48uuptch3j4_W3tfgYydJMdp2Xjg4VpI=w408-h544-k-no,Cafe,Cafe,4.6,9 AM-11 PM,Open All Days,+84 936 629 122,"CAM cafe, Pho Hai Loc, Hong Hai, Thanh pho Ha Long, Quang Ninh 200000, Vietnam",,https://www.google.com/maps/place/CAM+caf%C3%A9/data=!4m7!3m6!1s0x314a5728f23c1d75:0x6d149134495c1865!8m2!3d20.9459277!4d107.1041346!16s%2Fg%2F11h0t5lq4b!19sChIJdR088ihXSjERZRhcSTSRFG0?authuser=0&hl=en&rclk=1
ChIJ2WE-fqYP3ogR5WHGljkmyZo,CVS,"Drugstore chain selling a variety of beauty & health products, plus some grocery & household items.",False,93,"Name: Walgreens
link: https://www.google.com/maps/search/Walgreens/@28.129126499999998,-80.6722684?authuser=0&hl=en&entry=ttu
Reviews: 85 reviews

Name: Wickham Pharmacy
link: https://www.google.com/maps/search/Wickham+Pharmacy/@28.1237568,-80.67212959999999?authuser=0&hl=en&entry=ttu
Reviews: 63 reviews

Name: Melbourne Drugs
link: https://www.google.com/maps/search/Melbourne+Drugs/@28.1120882,-80.67218170000001?authuser=0&hl=en&entry=ttu
Reviews: 23 reviews

Name: Walmart Pharmacy
link: https://www.google.com/maps/search/Walmart+Pharmacy/@28.1228905,-80.6744786?authuser=0&hl=en&entry=ttu
Reviews: 12 reviews",https://www.cvs.com/store-locator/melbourne-fl-pharmacies/1800-n-wickham-rd-melbourne-fl-32935/storeid%3D573%3FWT.mc_id%3DLS_GOOGLE_FS_573,CVS (Owner),https://www.google.com/maps/contrib/117959774170367312158,https://lh5.googleusercontent.com/p/AF1QipOwWgBxnXtkf1nOGhoDZZjatY_hmtrY97_iAF8a=w408-h272-k-no,Drug store,"Drug store, Beauty supply store, Beer store, Convenience store, Cosmetics store, Greeting card shop, Perfume store, Stationery store, Vitamin & supplements store, Wine store",2.2,8 AM-10 PM,Open All Days,(321) 259-2333,"CVS, 1800 N Wickham Rd, Melbourne, FL 32935","prescriptions, call, text, insurance, auto, medicine, cashier, system, corporate, embarrass",https://www.google.com/maps/place/CVS/data=!4m7!3m6!1s0x88de0fa67e3e61d9:0x9ac9263996c661e5!8m2!3d28.1363911!4d-80.6722748!16s%2Fg%2F1tdqccx7!19sChIJ2WE-fqYP3ogR5WHGljkmyZo?authuser=0&hl=en&rclk=1
ChIJD9RC_NaxQDERoGtu31fTMgo,CAM Coffee,,False,49,"Name: Hung Coffee & Milk Tea
link: https://www.google.com/maps/search/H%C6%B0ng+Coffee+%26+Milk+Tea/@17.2259592,106.78740119999999?authuser=0&hl=en&entry=ttu
Reviews: 40 reviews

Name: Ca Phe Xanh
link: https://www.google.com/maps/search/C%C3%A0+Ph%C3%AA+Xanh/@17.225043,106.79400659999999?authuser=0&hl=en&entry=ttu
Reviews: 23 reviews

Name: Ca Phe Ve may bay Kien Giang Xua
link: https://www.google.com/maps/search/C%C3%A0+Ph%C3%AA+V%C3%A9+m%C3%A1y+bay+Ki%E1%BA%BFn+Giang+X%C6%B0a/@17.2241107,106.7904021?authuser=0&hl=en&entry=ttu
Reviews: 4 reviews

Name: Ca Phe Cung Dinh
link: https://www.google.com/maps/search/C%C3%A0+Ph%C3%AA+Cung+%C4%90%C3%ACnh/@17.2256241,106.78715229999999?authuser=0&hl=en&entry=ttu
Reviews: 2 reviews",https://www.facebook.com/cam.coffeeee/,CAM Coffee (Owner),https://www.google.com/maps/contrib/106808201256997370534,https://lh5.googleusercontent.com/p/AF1QipOEwK_FBKwKcSGtWPRS-WW7ZyhnH0HWu9z-tMCS=w408-h408-k-no,Cafe,Cafe,4.1,6:30 AM-10 PM,Open All Days,+84 898 182 814,"CAM Coffee, 04 Nguyen Tat Thanh, Lien Thuy, Le Thuy, Quang Binh, Vietnam",,https://www.google.com/maps/place/CAM+Coffee/data=!4m7!3m6!1s0x3140b1d6fc42d40f:0xa32d357df6e6ba0!8m2!3d17.2219336!4d106.7933553!16s%2Fg%2F11jp8zf0bk!19sChIJD9RC_NaxQDERoGtu31fTMgo?authuser=0&hl=en&rclk=1
ChIJH47FoFwBSzERaE14aaUxUYE,Huong Giang Coffee,,False,18,"Name: Nam Phong Coffee Cua Ong
link: https://www.google.com/maps/search/Nam+Phong+Coffee+Cua+Ong/@21.0266566,107.36822219999999?authuser=0&hl=en&entry=ttu
Reviews: 137 reviews

Name: Nang Coffe
link: https://www.google.com/maps/search/N%E1%BA%AFng+Coffe/@21.0004624,107.2771499?authuser=0&hl=en&entry=ttu
Reviews: 24 reviews",http://tangthuvien.vn/,Huong Giang Coffee (Owner),,https://lh5.googleusercontent.com/p/AF1QipN2qrVFc3zRRbDDMK4JQxqGKH4Iozxd3bzgxnIX=w408-h306-k-no,Cafe,Cafe,4.6,Open 24 hours,Open All Days,,"29J8+4QV Huong Giang Coffee, Cua Ong, Cam Pha, Quang Ninh, Vietnam",,https://www.google.com/maps/place/H%C6%B0%C6%A1ng+Giang+Coffee/data=!4m7!3m6!1s0x314b015ca0c58e1f:0x815131a569784d68!8m2!3d21.0303542!4d107.3669115!16s%2Fg%2F11byhkmx0z!19sChIJH47FoFwBSzERaE14aaUxUYE?authuser=0&hl=en&rclk=1
